{
  "$schema": "https://json-schema.org/draft/2020-12/schema",
  "$id": "https://tap.dev/schemas/boot-profile.schema.json",
  "title": "TAP Boot Profile",
  "description": "A TAP boot profile: a config-as-code document the bootloader (manage.py boot) applies in fixed phases to stand an instance up from a fresh, migrated database to a populated, usable instance. Profile data files live in the top-level boot/ directory (filename is the profile id). v0 carries a single population section of ordered seed-plugin / fire-collector steps; identity/auth sections and per-app schema composition are deferred (req-boot-sections). Spec: specs/spec-tap-boot-v0.md (req-boot-profile, req-boot-population).",
  "type": "object",
  "additionalProperties": false,
  "required": ["version"],
  "properties": {
    "version": {
      "description": "Profile schema version. 1 for the v0 ordered-steps shape.",
      "type": "integer",
      "const": 1
    },
    "description": {
      "description": "Human label shown by `boot --list` and in review.",
      "type": "string"
    },
    "auth": {
      "description": "The auth section (req-tap-auth-boot): external login providers, initial-admin emails, local-password toggle, and admin-lockout break-glass. tap_auth OWNS this section's schema (tap_auth/schemas/auth-boot-section.schema.json) and the bootloader composes it — only its object-shape is asserted here; the boot auth phase validates it strictly against the tap_auth fragment before applying. Omit for a local-password-only standup.",
      "type": "object"
    },
    "install": {
      "description": "The install section (req-boot-install-section): the desired package-mode plugin set for this instance plus the pre-migrate snapshot switch. Consumed by the settings-free PRE-BOOT stage as plain JSON BEFORE Django starts (req-boot-preboot), separately from and earlier than `population` (which enables/seeds them) — the NetBox local_requirements.txt-vs-PLUGINS split. Build-baked plugins (hardcoded in INSTALLED_APPS during the transition to full package-mode) are NOT listed here; only plugins installed from a source. Omit for an all-build-baked instance: pre-boot install then no-ops (the snapshot still runs).",
      "type": "object",
      "additionalProperties": false,
      "properties": {
        "snapshot_before_migrate": {
          "description": "Pre-migrate full-DB snapshot switch (req-boot-snapshot). Absent ⇒ true (safe-by-default: a prod profile that forgets the field still snapshots). This is a boot-variable: the effective value resolves flag > env (TAP_BOOT_INSTALL__SNAPSHOT_BEFORE_MIGRATE) > this profile field > default-true (req-boot-variable-resolution). Dev worktrees set the env override to false since dev DBs reset freely; a skipped snapshot logs loud (WARNING).",
          "type": "boolean"
        },
        "plugins": {
          "description": "Ordered list of package-mode plugins to uv-install in pre-boot before `migrate`. Each install is idempotent: an already-satisfied plugin re-runs as a fast no-op, so a reboot does not re-pull (req-boot-preboot-3).",
          "type": "array",
          "items": {
            "type": "object",
            "additionalProperties": false,
            "required": ["slug", "enabled", "source"],
            "properties": {
              "slug": {
                "description": "The plugin slug (tap-plugin.toml `slug`), which MUST equal the plugin's `tap.plugins` entry-point key. Every enabled `seed-plugin` slug in `population` must appear here or be build-baked, else pre-boot fails the static coherence guard before `migrate` (req-boot-install-section-3).",
                "type": "string",
                "minLength": 1
              },
              "enabled": {
                "description": "false skips the install without removing it (the 'comment it out' affordance).",
                "type": "boolean"
              },
              "note": {
                "description": "Free-text annotation for the human reader (e.g. why this source/rev).",
                "type": "string"
              },
              "source": {
                "description": "Where to install the plugin from — exactly one source type. 'git' is the headline distribution path (the same mechanism as a PyPI install, source-URL only); 'editable'/'path' are for local/dev.",
                "type": "object",
                "oneOf": [
                  {
                    "additionalProperties": false,
                    "required": ["type", "url", "rev"],
                    "properties": {
                      "type": {
                        "description": "git: install `tap-plugin-<slug> @ git+<url>@<rev>`, pinned to an immutable revision. Requires `git` in the runtime image.",
                        "const": "git"
                      },
                      "url": {
                        "description": "The git URL, e.g. https://github.com/org/tap-plugin-genericom.git",
                        "type": "string",
                        "minLength": 1
                      },
                      "rev": {
                        "description": "Immutable revision (commit SHA or tag) to pin. Never a moving branch — the pin is the reproducibility + idempotency oracle (req-boot-preboot-3).",
                        "type": "string",
                        "minLength": 1
                      },
                      "credential": {
                        "description": "Optional: the KEY of the source credential to authenticate this private repo (req-plugin-arch-source-secret-6). Names a `<key>.secret.json` under scope `tap_plugins/source` (kind `github_pat`), resolved in pre-boot and fed to git via GIT_ASKPASS — never interpolated into `url`. Omit for a public repo, or to fall back to the fleet-wide default source credential when one is mounted. Different plugins may name different credentials to pull from different private repos/orgs in one profile.",
                        "type": "string",
                        "minLength": 1
                      }
                    }
                  },
                  {
                    "additionalProperties": false,
                    "required": ["type", "path"],
                    "properties": {
                      "type": {
                        "description": "editable: `uv pip install --editable <path>` — resolves from the source tree (dev/local).",
                        "const": "editable"
                      },
                      "path": {
                        "description": "Path to the plugin's pyproject.toml directory, relative to the repo root (e.g. 'plugins/genericom').",
                        "type": "string",
                        "minLength": 1
                      }
                    }
                  },
                  {
                    "additionalProperties": false,
                    "required": ["type", "path"],
                    "properties": {
                      "type": {
                        "description": "path: non-editable install from a local directory or a built wheel.",
                        "const": "path"
                      },
                      "path": {
                        "description": "Path to the plugin directory or .whl, relative to the repo root.",
                        "type": "string",
                        "minLength": 1
                      }
                    }
                  }
                ]
              }
            }
          }
        }
      }
    },
    "population": {
      "description": "The population section: ordered steps that bring plugins online and populate them. Omit for a safe, no-outbound auth-only standup (req-boot-profile-4).",
      "type": "object",
      "additionalProperties": false,
      "required": ["steps"],
      "properties": {
        "on_failure": {
          "description": "Behavior when a step fails. 'abort' (default): stop, skip the rest, exit non-zero. 'continue': log and proceed; exit code still signals the failure.",
          "type": "string",
          "enum": ["abort", "continue"]
        },
        "steps": {
          "description": "Ordered list of population steps, applied strictly in array order, sequentially, with no overlap (req-boot-population-1). seed-plugin and fire-collector steps may interleave (req-boot-population-3).",
          "type": "array",
          "items": {
            "type": "object",
            "oneOf": [
              {
                "additionalProperties": false,
                "required": ["type", "plugin", "enabled"],
                "properties": {
                  "type": {
                    "description": "seed-plugin: bring a plugin online by importing its declared GRIFT bundles via the import_plugin_grift path.",
                    "const": "seed-plugin"
                  },
                  "plugin": {
                    "description": "The plugin slug (tap-plugin.toml `slug`), e.g. 'samsite'. Resolved against loaded TAP plugins; an unknown slug aborts before any population step runs (req-boot-population-4).",
                    "type": "string",
                    "minLength": 1
                  },
                  "bundle": {
                    "description": "Optional: import only this named manifest bundle instead of all of the plugin's declared bundles.",
                    "type": "string",
                    "minLength": 1
                  },
                  "enabled": {
                    "description": "false skips the step without removing it (the 'comment it out' affordance).",
                    "type": "boolean"
                  },
                  "note": {
                    "description": "Free-text annotation for the human reader (e.g. why a step is ordered where it is).",
                    "type": "string"
                  }
                }
              },
              {
                "additionalProperties": false,
                "required": ["type", "key", "enabled"],
                "properties": {
                  "type": {
                    "description": "fire-collector: fire a collector via run_collection and await its job to terminal.",
                    "const": "fire-collector"
                  },
                  "key": {
                    "description": "The collector's qualified registry key (scope:key) exactly as stored in Collector.collector_registry, e.g. 'plugins.aws_core.collectors.boto3_collector.collector:boto3'. Resolved against the collector registry; an unknown key aborts before any population step runs (req-boot-population-4).",
                    "type": "string",
                    "minLength": 1
                  },
                  "run_mode": {
                    "description": "'full' (default) runs self-test then collect; 'self_test_only' runs only the readiness probe.",
                    "type": "string",
                    "enum": ["full", "self_test_only"]
                  },
                  "timeout_seconds": {
                    "description": "Seconds to await this collector's job to a terminal state. Omit for the bootloader default (90s); set higher for slow collectors (a full cloud pull). Per-collector default timeouts are a backlog item (req-boot-collector-timeout).",
                    "type": "integer",
                    "minimum": 1
                  },
                  "enabled": {
                    "description": "false skips the step without removing it (the 'comment it out' affordance).",
                    "type": "boolean"
                  },
                  "note": {
                    "description": "Free-text annotation for the human reader (e.g. why a step is ordered where it is).",
                    "type": "string"
                  }
                }
              }
            ]
          }
        }
      }
    }
  }
}
