{
  "version": 1,
  "description": "Install-MVP validation profile: exercises the pre-boot install stage end-to-end with a single package-mode plugin (genericom). Pre-boot uv-installs genericom from its editable local source, checks static coherence (the population slug is in `install`), snapshots the DB, and emits TAP_PLUGINS so genericom loads into INSTALLED_APPS. Uses an editable source because git-source is proven in the packaging spike; the mechanism is identical (source-URL only).",
  "install": {
    "snapshot_before_migrate": true,
    "plugins": [
      {
        "slug": "genericom",
        "enabled": true,
        "source": { "type": "editable", "path": "plugins/genericom" },
        "note": "The one package-mode plugin. Editable local source for MVP validation; a real deployment uses a git source pinned to a rev."
      }
    ]
  },
  "population": {
    "on_failure": "abort",
    "steps": [
      {
        "type": "seed-plugin",
        "plugin": "genericom",
        "enabled": false,
        "note": "Present to exercise the static coherence guard (genericom is in `install`). Disabled: a full genericom seed depends on aws_core graph state beyond this minimal-set validation."
      }
    ]
  }
}
